{
  "document_type": "one_pager",
  "locale": "zh-CN",
  "meta": {
    "title": "AI 客服系统升级方案",
    "subtitle": "通过引入大语言模型，将客服响应时间缩短 60%，同时提升客户满意度至 90%+",
    "eyebrow": "Momo Paper / one_pager / zh-CN",
    "date": "2025-04-28",
    "author": "产品战略组"
  },
  "sections": {
    "summary": {
      "body": [
        "当前客服系统依赖纯人工处理，平均响应时间为 8 分钟，高峰期排队超过 30 分钟。客户满意度仅 72%，流失率逐年上升。"
      ],
      "points": [
        "引入 LLM 驱动的智能客服，覆盖 80% 的常见问题",
        "人工客服聚焦复杂投诉与VIP客户，资源利用率提升 3 倍",
        "预计 6 个月内 ROI 达到 250%"
      ]
    },
    "context": {
      "body": [
        "公司年客服工单量约 120 万单，人工成本占比达客服部门预算的 78%。高峰期（双11、618）工单量激增 400%，人工扩容成本极高且不可持续。",
        "竞品 A 已于 2024 年上线 AI 客服系统，客户满意度提升至 88%。若不尽快跟进，将面临客户流失风险。"
      ]
    },
    "evidence": {
      "body": [
        "在为期 2 个月的试点中，AI 客服处理了 3.2 万条咨询，其中 78% 无需人工介入即可闭环解决。平均响应时间从 8 分钟降至 45 秒。"
      ],
      "cards": [
        { "label": "响应时间降幅", "value": "60%", "unit": "提升" },
        { "label": "客户满意度", "value": "91%", "unit": "目标" },
        { "label": "成本节省", "value": "420", "unit": "万/年" },
        { "label": "预计 ROI", "value": "250%", "unit": "6 个月" }
      ]
    },
    "recommendation": {
      "body": [
        "建议 Q2 启动 AI 客服系统升级项目，分三阶段实施：技术选型与试点、全量上线、持续优化。"
      ],
      "actions": [
        "4 月：完成 LLM 供应商选型与技术架构设计",
        "5 月：启动试点，覆盖 20% 流量",
        "6 月：全量上线，人工客服转岗培训",
        "7-9 月：持续优化模型，目标 85% 自助解决率"
      ]
    }
  }
}
