{
  "document_type": "one_pager",
  "locale": "zh-CN",
  "meta": {
    "title": "Q2 产品增长方案",
    "subtitle": "基于用户行为数据与市场趋势，提出 Q2 重点增长策略及执行路径。",
    "eyebrow": "Momo Paper / one_pager / zh-CN",
    "date": "2026-05-02",
    "author": "产品团队"
  },
  "sections": {
    "summary": {
      "body": [
        "本方案针对当前用户留存下降、新用户激活不足两大痛点，提出「优化 onboarding → 强化核心功能 → 建设内容生态」三阶段增长路径。预计 Q2 末实现 DAU +18%，留存率 +8pp。",
        "核心策略围绕数据驱动决策：通过 A/B 实验验证每个假设，以周为单位迭代。"
      ],
      "points": [
        "DAU 目标 120 万（当前 102 万），+18%",
        "次日留存从 34% 提升至 42%，+8pp",
        "核心功能使用率从 28% 提升至 45%",
        "新用户 7 日内激活率从 22% 提升至 35%"
      ]
    },
    "context": {
      "body": [
        "过去两个季度，产品 DAU 增长趋缓（QoQ +3%），而竞品同期增长 12%。用户调研显示：新用户首次体验缺乏「aha moment」，60% 的用户在注册后 3 天内流失。同时，核心功能（协作编辑）的使用率仅 28%，远低于行业标杆 55%。",
        "市场环境方面，AI 辅助工具正在改变用户对协作产品的预期。我们需要在 Q2 建立差异化定位，否则将在下半年面临更激烈的竞争。"
      ]
    },
    "evidence": {
      "body": [
        "以下数据来自 Q1 产品分析报告和用户调研（N=1,200）："
      ],
      "cards": [
        {"label": "当前 DAU", "value": "102 万", "unit": "QoQ +3%"},
        {"label": "次日留存", "value": "34%", "unit": "行业中位 40%"},
        {"label": "核心功能使用", "value": "28%", "unit": "目标 45%"},
        {"label": "3 日流失", "value": "60%", "unit": "需降至 40% 以下"},
        {"label": "竞品增速", "value": "12%", "unit": "QoQ"},
        {"label": "NPS", "value": "28", "unit": "目标 40+"}
      ]
    },
    "recommendation": {
      "body": [
        "基于以上分析，建议 Q2 集中资源执行三阶段增长计划。每阶段设置明确的成功指标和决策节点，确保资源高效分配。"
      ],
      "actions": [
        "Phase 1（4 月）：重设计 onboarding 流程，引入交互式引导替代静态教程",
        "Phase 2（5 月）：强化协作编辑功能，增加实时评论和版本对比",
        "Phase 3（6 月）：建设模板内容生态，与 10 个行业 KOL 合作产出模板"
      ]
    }
  }
}
